{
 "version": 1,
 "image": "rc-port.png",
 "width": 200,
 "height": 140,
 "origin": "synth",
 "family": null,
 "style": "fixture",
 "parts": [
  {
   "id": "p1",
   "class": "port",
   "orientation": {
    "turn": 0,
    "mirror": false
   },
   "body": [
    20,
    60,
    44,
    100
   ],
   "pins": [
    {
     "name": "+",
     "x": 32,
     "y": 60
    },
    {
     "name": "−",
     "x": 32,
     "y": 100
    }
   ],
   "designator": "t1"
  },
  {
   "id": "p2",
   "class": "capacitor",
   "orientation": {
    "turn": 90,
    "mirror": false
   },
   "body": [
    80,
    20,
    102,
    40
   ],
   "pins": [
    {
     "name": "1",
     "x": 102,
     "y": 30
    },
    {
     "name": "2",
     "x": 80,
     "y": 30
    }
   ],
   "designator": "t2",
   "values": [
    "t3"
   ]
  },
  {
   "id": "p3",
   "class": "inductor",
   "orientation": {
    "turn": 0,
    "mirror": false
   },
   "body": [
    148,
    45,
    155.5,
    85
   ],
   "pins": [
    {
     "name": "1",
     "x": 150,
     "y": 45
    },
    {
     "name": "2",
     "x": 150,
     "y": 85
    }
   ],
   "designator": "t4",
   "values": [
    "t5"
   ]
  },
  {
   "id": "p4",
   "class": "ground",
   "orientation": {
    "turn": 0,
    "mirror": false
   },
   "body": [
    140,
    99,
    160,
    111
   ],
   "pins": [
    {
     "name": "1",
     "x": 150,
     "y": 100
    }
   ]
  },
  {
   "id": "p5",
   "class": "ground",
   "orientation": {
    "turn": 0,
    "mirror": false
   },
   "body": [
    22,
    109,
    42,
    121
   ],
   "pins": [
    {
     "name": "1",
     "x": 32,
     "y": 110
    }
   ]
  }
 ],
 "wires": [
  {
   "points": [
    [
     32,
     60
    ],
    [
     32,
     30
    ],
    [
     80,
     30
    ]
   ],
   "pen": 2
  },
  {
   "points": [
    [
     102,
     30
    ],
    [
     150,
     30
    ],
    [
     150,
     45
    ]
   ],
   "pen": 2
  },
  {
   "points": [
    [
     150,
     85
    ],
    [
     150,
     100
    ]
   ],
   "pen": 2
  },
  {
   "points": [
    [
     32,
     100
    ],
    [
     32,
     110
    ]
   ],
   "pen": 2
  }
 ],
 "junctions": [],
 "crossings": [],
 "texts": [
  {
   "id": "t1",
   "quad": [
    [
     2,
     48
    ],
    [
     14,
     48
    ],
    [
     14,
     56
    ],
    [
     2,
     56
    ]
   ],
   "string": "P1",
   "role": "designator"
  },
  {
   "id": "t2",
   "quad": [
    [
     82,
     6
    ],
    [
     95,
     6
    ],
    [
     95,
     14
    ],
    [
     82,
     14
    ]
   ],
   "string": "C1",
   "role": "designator"
  },
  {
   "id": "t3",
   "quad": [
    [
     82,
     44
    ],
    [
     100,
     44
    ],
    [
     100,
     54
    ],
    [
     82,
     54
    ]
   ],
   "string": "10p",
   "role": "value"
  },
  {
   "id": "t4",
   "quad": [
    [
     166,
     52
    ],
    [
     178,
     52
    ],
    [
     178,
     60
    ],
    [
     166,
     60
    ]
   ],
   "string": "L1",
   "role": "designator"
  },
  {
   "id": "t5",
   "quad": [
    [
     166,
     66
    ],
    [
     185,
     66
    ],
    [
     185,
     74
    ],
    [
     166,
     74
    ]
   ],
   "string": "4n7",
   "role": "value"
  }
 ],
 "annotations": [],
 "ignore": []
}
