{
 "version": 1,
 "image": "divider.png",
 "width": 200,
 "height": 200,
 "origin": "synth",
 "family": null,
 "style": "fixture",
 "parts": [
  {
   "id": "p1",
   "class": "terminal",
   "orientation": {
    "turn": 180,
    "mirror": false
   },
   "body": [
    56,
    11,
    64,
    19
   ],
   "pins": [
    {
     "name": "1",
     "x": 60,
     "y": 19
    }
   ]
  },
  {
   "id": "p2",
   "class": "resistor",
   "orientation": {
    "turn": 0,
    "mirror": false
   },
   "body": [
    52,
    40,
    68,
    80
   ],
   "pins": [
    {
     "name": "1",
     "x": 60,
     "y": 40
    },
    {
     "name": "2",
     "x": 60,
     "y": 80
    }
   ],
   "designator": "t1",
   "values": [
    "t2"
   ]
  },
  {
   "id": "p3",
   "class": "terminal",
   "orientation": {
    "turn": 270,
    "mirror": false
   },
   "body": [
    150,
    96,
    158,
    104
   ],
   "pins": [
    {
     "name": "1",
     "x": 150,
     "y": 100
    }
   ]
  },
  {
   "id": "p4",
   "class": "resistor",
   "orientation": {
    "turn": 0,
    "mirror": false
   },
   "body": [
    52,
    110,
    68,
    150
   ],
   "pins": [
    {
     "name": "1",
     "x": 60,
     "y": 110
    },
    {
     "name": "2",
     "x": 60,
     "y": 150
    }
   ],
   "designator": "t4",
   "values": [
    "t5"
   ]
  },
  {
   "id": "p5",
   "class": "ground",
   "orientation": {
    "turn": 0,
    "mirror": false
   },
   "body": [
    50,
    164,
    70,
    176
   ],
   "pins": [
    {
     "name": "1",
     "x": 60,
     "y": 165
    }
   ]
  }
 ],
 "wires": [
  {
   "points": [
    [
     60,
     19
    ],
    [
     60,
     40
    ]
   ],
   "pen": 2
  },
  {
   "points": [
    [
     60,
     80
    ],
    [
     60,
     110
    ]
   ],
   "pen": 2
  },
  {
   "points": [
    [
     60,
     100
    ],
    [
     150,
     100
    ]
   ],
   "pen": 2
  },
  {
   "points": [
    [
     60,
     150
    ],
    [
     60,
     165
    ]
   ],
   "pen": 2
  }
 ],
 "junctions": [
  [
   60,
   100
  ]
 ],
 "crossings": [],
 "texts": [
  {
   "id": "t1",
   "quad": [
    [
     76,
     48
    ],
    [
     88,
     48
    ],
    [
     88,
     56
    ],
    [
     76,
     56
    ]
   ],
   "string": "R1",
   "role": "designator"
  },
  {
   "id": "t2",
   "quad": [
    [
     76,
     62
    ],
    [
     88,
     62
    ],
    [
     88,
     70
    ],
    [
     76,
     70
    ]
   ],
   "string": "1k",
   "role": "value"
  },
  {
   "id": "t3",
   "quad": [
    [
     128,
     86
    ],
    [
     149,
     86
    ],
    [
     149,
     94
    ],
    [
     128,
     94
    ]
   ],
   "string": "OUT",
   "role": "net"
  },
  {
   "id": "t4",
   "quad": [
    [
     76,
     118
    ],
    [
     88,
     118
    ],
    [
     88,
     126
    ],
    [
     76,
     126
    ]
   ],
   "string": "R2",
   "role": "designator"
  },
  {
   "id": "t5",
   "quad": [
    [
     76,
     132
    ],
    [
     94,
     132
    ],
    [
     94,
     140
    ],
    [
     76,
     140
    ]
   ],
   "string": "2k2",
   "role": "value"
  }
 ],
 "annotations": [],
 "ignore": []
}
