{
 "version": 1,
 "image": "crossing.png",
 "width": 200,
 "height": 200,
 "origin": "synth",
 "family": null,
 "style": "fixture",
 "parts": [
  {
   "id": "p1",
   "class": "source-dc",
   "orientation": {
    "turn": 0,
    "mirror": false
   },
   "body": [
    20,
    70,
    44,
    90
   ],
   "pins": [
    {
     "name": "+",
     "x": 32,
     "y": 70
    },
    {
     "name": "−",
     "x": 32,
     "y": 90
    }
   ],
   "variant": "battery",
   "designator": "t1"
  },
  {
   "id": "p2",
   "class": "diode",
   "orientation": {
    "turn": 0,
    "mirror": false
   },
   "body": [
    90,
    120,
    110,
    150
   ],
   "pins": [
    {
     "name": "a",
     "x": 100,
     "y": 120
    },
    {
     "name": "c",
     "x": 100,
     "y": 150
    }
   ],
   "designator": "t2"
  },
  {
   "id": "p3",
   "class": "ground",
   "orientation": {
    "turn": 0,
    "mirror": false
   },
   "body": [
    90,
    169,
    110,
    181
   ],
   "pins": [
    {
     "name": "1",
     "x": 100,
     "y": 170
    }
   ]
  }
 ],
 "wires": [
  {
   "points": [
    [
     32,
     70
    ],
    [
     32,
     40
    ],
    [
     199,
     40
    ]
   ],
   "pen": 2
  },
  {
   "points": [
    [
     100,
     1
    ],
    [
     100,
     120
    ]
   ],
   "pen": 2
  },
  {
   "points": [
    [
     100,
     150
    ],
    [
     100,
     170
    ]
   ],
   "pen": 2
  },
  {
   "points": [
    [
     32,
     90
    ],
    [
     32,
     160
    ],
    [
     100,
     160
    ]
   ],
   "pen": 2
  }
 ],
 "junctions": [],
 "crossings": [
  [
   100,
   40
  ]
 ],
 "texts": [
  {
   "id": "t1",
   "quad": [
    [
     2,
     58
    ],
    [
     14,
     58
    ],
    [
     14,
     66
    ],
    [
     2,
     66
    ]
   ],
   "string": "V1",
   "role": "designator"
  },
  {
   "id": "t2",
   "quad": [
    [
     116,
     130
    ],
    [
     129,
     130
    ],
    [
     129,
     138
    ],
    [
     116,
     138
    ]
   ],
   "string": "D1",
   "role": "designator"
  }
 ],
 "annotations": [],
 "ignore": []
}
